{
  "schemaVersion": 2,
  "scoreVersion": "2.1",
  "title": "V2 nested source and event identity",
  "date": "2026-09-24",
  "radar": "dev",
  "signalCount": 3,
  "highSignalCount": 1,
  "actionableCount": 2,
  "verdict": "V2 fixture for normalization only.",
  "topics": ["ai-coding", "developer-tools"],
  "reportConfidence": "medium",
  "publish": false,
  "highlights": [
    {
      "title": "Adopt candidate",
      "type": "ai-coding",
      "signal": "high",
      "score": 82,
      "action": "adopt",
      "topic": "ai-coding",
      "primaryRadar": "dev",
      "relatedRadars": ["ai"],
      "whyItMatters": "This changes a concrete developer workflow decision.",
      "entity": "zai-org/zcode",
      "eventType": "release",
      "eventKey": "zai-zcode-release-2026-09",
      "firstSeen": "2026-09-24",
      "lastSeen": "2026-09-24",
      "confidence": "medium",
      "source": { "level": "ecosystem", "name": "ZCode repository", "url": "https://example.com/zcode" }
    },
    {
      "title": "Test candidate",
      "type": "developer-tool",
      "signal": "medium",
      "score": 64,
      "action": "test",
      "topic": "developer-tools",
      "primaryRadar": "dev",
      "relatedRadars": [],
      "whyItMatters": "Testing this may change the current development tool choice.",
      "entity": "example/test-tool",
      "eventType": "product-update",
      "eventKey": "example-test-tool-update-2026-09",
      "firstSeen": "2026-09-24",
      "lastSeen": "2026-09-24",
      "confidence": "high",
      "source": { "level": "official", "name": "Example project", "url": "https://example.com/test" }
    },
    {
      "title": "Ignore candidate",
      "type": "developer-tool",
      "signal": "low",
      "score": 24,
      "action": "ignore",
      "topic": "developer-tools",
      "primaryRadar": "dev",
      "entity": "example/old-tool",
      "eventType": "adoption-signal",
      "eventKey": "example-old-tool-signal-2026-09",
      "firstSeen": "2026-09-24",
      "lastSeen": "2026-09-24",
      "confidence": "low",
      "source": { "level": "community", "name": "Community report" }
    }
  ]
}
